,Ticker,Company Name,Fill Date,Risk Factors Text
5,ADM,ARCHER-DANIELS-MIDLAND CO,2024-03-12,"RISK FACTORS (Continued)The Company’s IT systems, processes, and sites may suffer cyber security breaches, which could expose the Company to operational and various regulatory risks.Increased IT security and social engineering threats and more sophisticated computer crime, including advanced persistent threats, pose a potential risk to the security of the Company’s IT systems, networks, and services, as well as the confidentiality, availability, and integrity of the Company’s third party data.  The Company is subject to a variety of laws and regulations in the United States and other jurisdictions regarding privacy, data protection, and data security, including those related to the collection, storage, handling, use, disclosure, transfer, and security of personal data.  Compliance with and interpretation of various data privacy regulations continue to evolve and any violation could subject the Company to legal claims, regulatory penalties, and damage to its reputation.  The Company has put in place security measures to endeavor to prevent, detect, and mitigate cyber-based attacks, and has instituted control procedures for cybersecurity incident response plans for its critical systems.  In addition, the Company monitors this risk on an ongoing basis to detect and correct breaches, and reports metrics on the quality of the Company’s data security efforts and control environment to the highest level of management and to the Board of Directors.  However, if the Company’s IT systems are breached, damaged, or cease to function properly due to any number of causes, such as catastrophic events, power outages, security breaches, or cyber-based attacks, and the Company’s recovery efforts do not effectively mitigate the risks on a timely basis, the Company may suffer significant interruptions in its ability to manage its operations, loss of valuable data, actual or threatened legal actions, and damage to its reputation, which may adversely impact the Company’s revenues, operating results, and financial condition.Generative AI advancements are progressing at an unprecedented pace, which brings risks that could subject the Company to loss through various technical, legal, and opportunistic-related risks.The pace of Generative AI and the complex and dynamic regulatory environment subjects the Company to a variety of risks including, but not limited to, data privacy and security vulnerabilities, unauthorized third-party usage of Company data associated with training models, malicious use and advanced deceitful communication methods, missed innovation opportunities, and potential competitive disadvantages.  Guidance for awareness and responsible Generative AI use to protect ADM data from a legal and ethical standpoint, along with technological development for opportunistic uses, monitoring, and oversight are important components of the Company’s risk mitigation approach"
7,ADM,ARCHER-DANIELS-MIDLAND CO,2023-02-14,"RISK FACTORS (Continued)Regulatory RisksThe Company is subject to numerous laws, regulations, and mandates globally which could adversely affect the Company’s operating results and forward strategy.The Company does business globally, connecting crops and markets in over 190 countries, and is required to comply with laws and regulations administered by the United States federal government as well as state, local, and non-U.S. governmental authorities in numerous areas including:  accounting and income taxes, anti-corruption, anti-bribery, global trade, trade sanctions, privacy and security, environmental, product safety, and handling and production of regulated substances.  The Company frequently faces challenges from U.S. and foreign tax authorities regarding the amount of taxes due including questions regarding the timing, amount of deductions, the allocation of income among various tax jurisdictions, and further risks related to changing tax laws domestically and globally.  Any failure to comply with applicable laws and regulations or appropriately resolve these challenges could subject the Company to administrative, civil, and criminal remedies, including fines, penalties, disgorgement, injunctions, and recalls of its products, and damage to its reputation.Regulations specifically affecting the agricultural sector and related industries; regulatory policies or matters that affect a variety of businesses; and taxation polices could adversely affect the Company’s operating results.Agricultural production and trade flows are subject to government policies, mandates, regulations, and trade agreements, including taxes, tariffs, duties, subsidies, incentives, foreign exchange rates, and import and export restrictions, including policies related to genetically modified organisms, traceability standards, sustainable practices, product safety and labeling, renewable fuels, and low carbon fuel mandates.  These policies can influence the planting of certain crops; the location and size of crop production; whether unprocessed or processed commodity products are traded; the volume and types of imports and exports; the availability and competitiveness of feedstocks as raw materials; the viability and volume of production of certain of the Company’s products; and industry profitability.  For example, changes in government policies or regulations of ethanol and biodiesel including, but not limited to, changes in the Renewable Fuel Standard program under the Energy Independence and Security Act of 2007 in the United States, including the treatment of small refinery exemptions, can have an impact on the Company’s operating results.  International trade regulations can adversely affect agricultural commodity trade flows by limiting or disrupting trade between countries or regions.  Regulations of financial markets and instruments, including the Dodd-Frank Act, Consumer Protection Act, and the European Market Infrastructure Regulation, create uncertainty and may lead to additional risks and costs, and could adversely affect the Company’s futures commission merchant business and its agricultural commodity risk management practices.  Future government policies may adversely affect the supply of, demand for, and prices of the Company’s products; adversely affect the Company’s ability to deploy adequate hedging programs; restrict the Company’s ability to do business in its existing and target markets; and adversely affect the Company’s revenues and operating results.The Company’s strategy involves expanding the volume and diversity of crops it merchandises and processes, expanding the global reach of its core model, expanding its value-added product portfolio, and expanding the sustainable agriculture programs and partnerships it participates in.  Government policies including, but not limited to, antitrust and competition law, trade restrictions, food safety regulations, sustainability requirements, and traceability, can impact the Company’s ability to execute this strategy successfully"
4,ADM,ARCHER-DANIELS-MIDLAND CO,2022-02-17,"RISK FACTORS (Continued)The Company is subject to industry-specific risks which could adversely affect the Company’s operating results.The Company is subject to industry-specific risks which include, but are not limited to, product safety and quality; launch of new products by other industries that can replace the functionalities of the Company’s production; shifting consumer preferences; federal, state, and local regulations on manufacturing or labeling; socially acceptable and sustainable farming practices; environmental, health, and safety regulations; and customer product liability claims.  The liability which could result from certain of these risks may not always be covered by, or could exceed liability insurance related to product liability and food safety matters maintained by the Company.  The Company has a particularly strong capability and culture around occupational health and safety and food safety; however, risks to the Company’s reputation may exist due to potential negative publicity caused by product liability, food safety, occupational health and safety, workforce diversity, and environmental matters.Certain of the Company’s merchandised commodities and finished products are used as ingredients in livestock and poultry feed.  The Company is subject to risks associated with economic, product quality, feed safety or other factors which may adversely affect the livestock and poultry businesses, including the outbreak of disease in livestock and poultry, for example African swine fever, which could adversely affect demand for the Company’s products used as ingredients in feed.  In addition, as the Company increases its investment in flavors and ingredients businesses, it is exposed to increased risks related to rapidly changing consumer preferences and the impacts these changes could have on the success of certain of the Company's customers.The Company has limited control over and may not realize the expected benefits of its equity investments and joint ventures and may not be able to monetize the investments at an attractive value when the Company decides to exit the investments. The Company has $5.3 billion invested in or advanced to joint ventures and investments over which the Company has limited control as to governance and management activities.  Net sales to unconsolidated affiliates during the year ended December 31, 2021 were $6.6 billion.  Risks related to these investments may include:  the financial strength of the investment partner; loss of revenues and cash flows to the investment partner and related gross profit; the inability to implement beneficial management strategies, including risk management and compliance monitoring, with respect to the investment’s activities; and the risk that the Company may not be able to resolve disputes with the partners.  The Company may encounter unanticipated operating issues, financial results, or compliance and reputational risks related to these investments.  The Company mitigates this risk using controls and policies related to joint venture formation, governance (including board of directors’ representation), merger and acquisition integration management, and harmonization of joint venture policies with the Company’s policies and controls"
1,ADM,ARCHER-DANIELS-MIDLAND CO,2021-02-18,"RISK FACTORS (Continued)The Company may fail to realize the benefits of or experience delays in the execution of its growth strategy, which encompasses organic and inorganic initiatives, including those outside the U.S. and in businesses where the Company does not currently have a large presence.As the Company executes its growth strategy, through both organic and inorganic growth, it may encounter risks which could result in increased costs, decreased revenues, and delayed synergies.  Growth in new geographies outside the U.S. can expose the Company to volatile economic, political, and regulatory risks that may negatively impact its operations and ability to achieve its growth strategy.  Expanding businesses where the Company has limited presence may expose the Company to risks related to the inability to identify an appropriate partner or target and favorable terms, inability to retain/hire strategic talent, or integration risks that may require significant management resources that would have otherwise been available for ongoing growth or operational initiatives.  Acquisitions may involve unanticipated delays, costs, and other problems.  Due diligence performed prior to an acquisition may not identify a material liability or issue that could impact the Company's reputation or adversely affect results of operations resulting in a reduction of the anticipated acquisition benefits.  Additionally, acquisitions may involve integration risks such as: internal control effectiveness, system integration risks, the risk of impairment charges related to goodwill and other intangibles, ability to retain acquired employees, and other unanticipated risks.The Company is subject to industry-specific risks which could adversely affect the Company’s operating results.The Company is subject to industry-specific risks which include, but are not limited to, product safety and quality; launch of new products by other industries that can replace the functionalities of the Company’s production; shifting consumer preferences; federal, state, and local regulations on manufacturing or labeling; socially acceptable and sustainable farming practices; environmental, health, and safety regulations; and customer product liability claims.  The liability which could result from certain of these risks may not always be covered by, or could exceed liability insurance related to product liability and food safety matters maintained by the Company.  The Company has a particularly strong capability and culture around occupational health and safety and food safety; however, risks to the Company’s reputation may exist due to potential negative publicity caused by product liability, food safety, occupational health and safety, workforce diversity, and environmental matters.Certain of the Company’s merchandised commodities and finished products are used as ingredients in livestock and poultry feed.  The Company is subject to risks associated with economic, product quality, feed safety or other factors which may adversely affect the livestock and poultry businesses, including the outbreak of disease in livestock and poultry, for example African swine fever, which could adversely affect demand for the Company’s products used as ingredients in feed.  In addition, as the Company increases its investment in flavors and ingredients businesses, it is exposed to increased risks related to rapidly changing consumer preferences and the impacts these changes could have on the success of certain of the Company's customers"
6,ADM,ARCHER-DANIELS-MIDLAND CO,2020-02-18,"RISK FACTORS (Continued)The Company may fail to realize the benefits or experience delays in the execution of its growth strategy, encompassing organic and inorganic initiatives, outside the U.S. and in businesses where the Company does not currently have a large presence.As the Company executes its growth strategy, through both organic and inorganic growth, it may encounter risks which could result in increased costs, decreased revenues, and delayed synergies.  Recent investments outside the U.S. include Neovia, certain assets of Brazil-based Algar Agro, Protexin, Ziegler, Rodelle, Inc., and Yerbalatina.  Growth in new geographies outside the U.S. can expose the Company to volatile economic, political, and regulatory risks that may negatively impact its operations and ability to achieve its growth strategy.  Expanding businesses where the Company has limited presence may expose the Company to risks related to the inability to identify an appropriate partner or target and favorable terms, inability to retain/hire strategic talent, or integration risks that may require significant management resources that would have otherwise been available for ongoing growth or operational initiatives.  Acquisitions may involve unanticipated delays, costs, and other problems.  Due diligence performed prior to the acquisition may not identify a material liability or issue that could impact the Company's reputation or adversely affect results of operations resulting in a reduction of the anticipated acquisition benefits.  Additionally, acquisitions may involve integration risks such as:  internal control effectiveness, system integration risks, the risk of impairment charges related to goodwill and other intangibles, ability to retain acquired employees, and other unanticipated risks"
8,ADM,ARCHER-DANIELS-MIDLAND CO,2019-02-19,"RISK FACTORS (Continued)The Company has limited control over and may not realize the expected benefits of its equity investments and joint ventures. The Company has $5.3 billion invested in or advanced to joint ventures and investments over which the Company has limited control as to the governance and management activities.  Net sales to unconsolidated affiliates during the year ended December 31, 2018 was $6.8 billion.  Risks related to these investments may include:  The financial strength of the investment partner; loss of revenues and cash flows to the investment partner and related gross profit; the inability to implement beneficial management strategies, including risk management and compliance monitoring, with respect to the investment’s activities; and the risk that the Company may not be able to resolve disputes with the partner.  The Company may encounter unanticipated operating issues, financial results, or compliance and reputational risks related to these investments.  The Company mitigates this risk using controls and policies related to joint venture formation, governance (including board of directors’ representation), merger and acquisition integration management, and harmonization of joint venture policies with the Company’s policies and controls. The Company’s information technology (IT) systems, processes, and sites may suffer interruptions, security breaches, or failures which may affect the Company’s ability to conduct its business. The Company’s operations rely on certain key IT systems, some of which are dependent on services provided by third parties, to provide critical data connectivity, information, and services for internal and external users.  These interactions include, but are not limited to: Ordering and managing materials from suppliers; risk management activities; converting raw materials to finished products; inventory management; shipping products to customers; processing transactions; summarizing and reporting results of operations; human resources benefits and payroll management; and complying with regulatory, legal or tax requirements.  The Company is also in the process of implementing a new enterprise resource planning (ERP) system on a worldwide basis as part of its ongoing business transformation program, which is expected to improve the efficiency and effectiveness of certain financial and business transaction processes and the underlying systems environment.  Increased IT security and social engineering threats and more sophisticated computer crime, including advanced persistent threats, pose a potential risk to the security of the Company’s IT systems, networks, and services, as well as the confidentiality, availability, and integrity of the Company’s third party data.  The Company is subject to a variety of laws and regulations in the United States and other jurisdictions regarding privacy, data protection, and data security, including those related to the collection, storage, handling, use, disclosure, transfer, and security of personal data.  Compliance with and interpretation of data privacy regulations, including the European Union General Data Protection Regulation implemented in 2018, continues to evolve and any violation could subject the Company to legal claims, regulatory penalties, and damage to its reputation.  The Company has put in place security measures to prevent, detect, and mitigate cyber-based attacks, and has instituted control procedures for cyber security incident responses and disaster recovery plans for its critical systems.  In addition, the Company monitors this risk on an ongoing basis to detect and correct any breaches, and reports metrics on the quality of the Company’s data security efforts and control environment to the highest level of management and to the Board of Directors.  However, if the Company’s IT systems are breached, damaged, or cease to function properly due to any number of causes, such as catastrophic events, power outages, security breaches, or cyber-based attacks, and the Company’s disaster recovery plans do not effectively mitigate the risks on a timely basis, the Company may suffer significant interruptions in its ability to manage its operations, loss of valuable data, actual or threatened legal actions, and damage to its reputation, which may adversely impact the Company’s revenues, operating results, and financial condition.The Company may fail to realize the benefits or experience delays in the execution of its growth strategy, encompassing organic and inorganic initiatives, outside the U.S. and in businesses where the Company does not currently have a large presence.As the Company executes its growth strategy, through both organic and inorganic growth, it may encounter risks which could result in increased costs, decreased revenues, and delayed synergies.  Recent investments outside the U.S. include Neovia, certain assets of Brazil-based Algar Agro, Protexin, and Rodelle, Inc.  Growth in new geographies outside the U.S. can expose the Company to volatile economic, political, and regulatory risks that may negatively impact its operations and ability to achieve its growth strategy.  Expanding businesses where the Company has limited presence may expose the Company to risks related to the inability to identify an appropriate partner or target and favorable terms, inability to retain/hire strategic talent, or integration risks that may require significant management resources that would have otherwise been available for ongoing growth or operational initiatives.  Acquisitions may involve unanticipated delays, costs, and other problems.  Due diligence performed prior to the acquisition may not identify a material liability or issue that could impact the Company's reputation or adversely affect results of operations resulting in a reduction of the anticipated acquisition benefits.  Additionally, acquisitions may involve integration risks such as:  internal control effectiveness, system integration risks, the risk of impairment charges related to goodwill and other intangibles, ability to retain acquired employees, and other unanticipated risks.14"
