,Ticker,Company Name,Fill Date,Risk Factors Text
12,GIGA,GIGA-TRONICS INC,2024-04-15,"ITEM 1A. RISK FACTORSAn investment in our common stock involves significant risks. Before investing in our common stock, you should consider each of the following risk factors and any other information set forth in this Report and the other reports filed by the Company with the Securities and Exchange Commission (the “SEC”),including the Company’s financial statements and related notes, in evaluating the Company’s business and prospects. The risks and uncertainties described below are not the only ones that impact on the Company’s operations and business. Additional risks and uncertainties not presently known to the Company, or that the Company currently considers immaterial, may also impair its business or operations. If any of the following risks actually occurs, the Company’s business and financial condition, results or prospects could be harmed. Please also read carefully the section entitled “Forward-Looking Statements” at the beginning of this Report. If any of the events or developments described below occurs, our business, financial condition and results of operations may suffer. In that case, the value of our common stock may decline and you could lose all or part of your investment.Risk Factors
 SummaryOur business and an investment in our common stock are subject to numerous risks and uncertainties, including those highlighted in this “Risk Factors
